Position,Location,Clearance,JobID,RoleDescription,BasicQualifications,AdditionalQualifications
Data Scientist,"Seattle, WA",TS/SCI,9345,"Develop and operationalize innovative Big Data software solutions in direct support of an unconventional warfare client. Perform as a data scientist, helping the team on a distributed scalable Big Data store, including Apache Accumulo, Apache Hadoop, MapReduce programming and technologies, and real-time data processing with Apache Spark. Participate in the development of machine learning, data mining, and statistical or graph-based algorithms designed to fuse and analyze massive data sets. Use expertise to ensure the proper implementation and usage of employed algorithms and bring in cutting-edge innovations from industry and academia. Leverage knowledge of requirements analysis, installation, integration, evaluation, enhancement, maintenance, testing, and diagnosis or resolution. Conduct software development, software integration, statistical analysis, modeling, and simulation all in a rapid DevOps environment. Sync across functional teams, ensuring data science is supporting mission-focused analytic teams and work with rapid prototyping teams on site to deploy new data science capabilities through existing toolsets.","*3+ years of experience with high-level languages, including Java *2+ years of experience with distributed scalable Big Data storage, including Accumulo, Cloudbase, HBase, or Bigtable *Experience in MapReduce programming with Apache Hadoop, the Hadoop Distributed File System (HDFS), and processing large data stores *Experience with a real-time, large-scale data processing engine, including Apache Spark*Experience with using Agile software development methods in a DevOps environment*Experience with developing solutions and integrating and extending free and Open-source software (FOSS) or COTS products*Ability to exhibit flexibility, initiative, and innovation when dealing with ambiguous and fast-paced situations *TS/SCI clearance in JPAS *BA or BS degree","*Experience in working with various intelligence disciplines, including GEOINT, HUMINT, MASINT, OSINT, and SIGINT and comprehension of the data and tools associated with these disciplines*Experience with intelligence or operations analysis in the DoD or intelligence community*Experience with deploying applications in a Cloud environment*Experience with designing and developing automated analytic software, techniques, and algorithms*Experience with open source software, including GeoWave and MapReduce Geo (MrGEO)*Security+ or CISSP and DoD 8570 Compliance Certifications"
Systems Engineer,"San Diego, CA",TS/SCI/CI,2237,,,
Full Stack Developer,"New York, NY",TS/SCI/FSP,9012,"Develop innovative software solutions in direct support of an unconventional warfare client. Compose solutions that incorporate micro services, containerization, RESTful Web components, NoSQL data frameworks, and large–scale distributed systems to drive insights from vast amounts of structured and unstructured data. Leverage a complete DevOps pipeline to drive rapid delivery of functionality to the client at hyper speed. Engage with multiple functional groups to comprehend client challenges, prototype new ideas and new technologies, and help to create solutions to drive the next wave of innovation. Design, implement, schedule, test, and deploy full features and components of solutions. Ensure quality delivery of software through thorough testing and reviews.","*3+ years of experience with software design, implementation, and testing *3+ years of experience with using best practices and design patterns for writing clean, reusable, and highly organized code *Experience with large–scale distributed systems and large–scale data processing solutions, including Hadoop and Accumulo *Experience with software containerization frameworks, including DOCKER *Experience with developing service APIs for external consumption *Knowledge of data structures and algorithms and how things fit together with modular design *TS/SCI clearance in JPAS *Knowledge of RESTful services design, development, and testing *BS degree","*Experience with DevOps methods and tools, including Jenkins, Git, or Jira *Experience with solutions for full–text search, hit highlighting, and faceted search, including SOLR or ElasticSearch *Experience with using JavaScript libraries, including jQuery, D3, Leaflet, or YUI *Experience with HTML and CSS and solving cross–browser compatibility issues *Knowledge of at least one scripting language, including JavaScript, Node, Python, or Bash *Knowledge of at least one of the following servlet containers, including Apache Tomcat, JBoss, or Jetty *Knowledge of scaling and performance *Knowledge of Hadoop or other Big Data solutions *Knowledge of the whole Web stack, including protocols and Web server optimization techniques *Knowledge of Service–Oriented Architecture (SOA) development *Ability to demonstrate clean coding habits, pay strict attention to detail, and focus on quality *Ability to learn technical concepts quickly and communicate with multiple functional groups *Possession of excellent analytical and problem solving skills *Security+ or CISSP Certification"
Front End Application Developer,"Chantilly, VA",TS/SCI,4501,"Are you looking for an opportunity to create an amazing user experience? The right interface can make a mission efficient, encourage early adoption, and save time and resources. We’re looking for you, a developer who will use equal parts skill and vision to build an experience that delivers functionality and efficiency. This is an opportunity to contribute to a project that meets challenges in the client organization by collaborating with a development team to build solutions to combat ever-changing threats with user-centric design. You’ll work with a team of intelligence analysts, business systems analysts, software developers, and network engineers to create a seamless user experience using JavaScript, Angular, HTML, CSS, Restful APIs, Java, Leaflet, and D3. You’ll develop your skills and learn how to ensure accessibility for all users by developing a front end that functions across browsers, platforms, and devices while meeting accessibility and security requirements. With mentoring, positive code reviews, and opportunities to learn new tools and skills, we focus on growing as a team to make the best solutions for our customers.","*3+ years of experience with programming in at least one of the following: C#, Java, Unity3D, Python, or JavaScript *Experience with usability analysis, testing, and client-facing engagements, including design discussions and product demonstrations *Experience with switching between different languages and learning new ones, as necessary *Knowledge of UI development, data analysis and visualization, and software design *TS/SCI clearance","*Experience with building solutions that directly enable the mission of US military or US intelligence community*Experience in working with various intelligence disciplines, including GEOINT, HUMINT, MASINT, OSINT, and SIGINT and the data and tools associated with these disciplines*Experience with Agile or Kanban software development methods *Experience with multi-threaded code, 3D drawing algorithms, and multiplayer networking*Experience with optimizing code for memory, CPU, and file constraints*Experience with developing front-end applications using JavaScript and at least one JavaScript framework, including AngularJS, Angular, Vue, React, or Dojo*Experience with HTML and CSS, including CSS frameworks, such as Material Design, Bootstrap, or Foundation*Experience with TypeScript, ES6/ECMA2015, or Babel*Experience with ArcGIS Server or Portal and interoperability with custom Web applications*Experience with a task runner or build system, including Gulp, Grunt, Webpack, or Rollup*Experience with testing frameworks, including Protractor, Jasmine, Karma, or Selenium*Experience with at least one JavaScript package manager, including npm, bower, or yarn*Experience with using JavaScript mapping libraries, including ArcGIS, Leaflet, or Mapbox*Experience with developing back end RESTful micro-services using languages, including Python or NodeJS*Experience with network security, including access and authorization for PKI and chain trusting*Knowledge of JIRA, Confluence, Git, and GitLab*BA or BS degree*DoD 8570 Compliant Security+ or CISSP Certification"
Front End Web Developer,"Dallas, TX",TS/SCI,3857,"Develop innovative software solutions in direct support to unconventional warfare clients. Create intuitive and innovative front end Web applications for use across the DoD and intelligence community. Leverage the latest technologies and frameworks, including Node and Angular or React or Vue in a DevOps pipeline. Create intuitive visualizations of large scale data and analytics using strong user experience principles. Engage with multiple functional groups to comprehend client challenges, prototype new ideas and new technologies, and help to create solutions to drive the next wave of innovation. Design, implement, schedule, test, and deploy full features and components of solutions. Ensure quality delivery of software through thorough testing and reviews.","*5+ years of experience with using HTML and CSS, including CSS frameworks, such as Bootstrap or Foundation *3+ years of experience with developing front–end applications using JavaScript and a JavaScript framework, including Angular, React, and Vue*Experience with server–side application development using languages, including Java, PHP, or Python*Experience with using Agile software development methods in a DevOps environment*Experience with usability analysis, testing, and client–facing engagements, including design discussions and product demonstrations *Experience with a structured build software, including Gulp, Grunt, or NPM*TS/SCI clearance in JPAS*DoD 8570 Compliant Security+ or CISSP Certification prior to starting on contract","*Experience in working with various intelligence disciplines, including GEOINT, HUMINT, MASINT, OSINT, and SIGINT and a comprehension of the data and tools associated with these disciplines*Experience with Unmanned Aerial Systems (UAS) operations, including small Unmanned Aircraft Systems (sUAS)*Experience with testing frameworks, including Jasmine, Karma, or Selenium *Experience with Linux scripting in BASH or Perl  *Experience with using JavaScript visualization libraries, including D3, Leaflet, CytoscapeJS, and VizJS*Experience with network security, including access and authorization for PKI and chain trusting *Experience with Agile development methodologies *Knowledge of JIRA, Confluence, Git, and GitHub/GitLab *Knowledge of Web development, JavaScript, JSON REST, CORS, JSONP, Web architecture, and HTTP specification*BS degree"
Mid-Level Software Engineer,"Albany, NY",TS/SCI/FSP,7311,,,
Technology Enabled Analyst,"Nashville, TN",TS/SCI/CI,9845,"Provide support to client forces through all-source multi-INT fusion analysis methodology development. Integrate data from diverse intelligence disciplines, including SIGINT, MASINT, GEOINT, IMINT, and HUMINT, leverage technology and rapid prototyping to illuminate entities and networks of interest, and support both conventional and other forces CONUS and OCONUS. Comprehend and leverage all sources of information, including INTs, open source material, law enforcement data, and other government data or information on a specific topic or target under limited supervision. Use structured methodologies and techniques appropriate to the topic and apply specialized subject matter expertise to guide efforts. Analyze analytical methodologies tailored to customers who range from tactical to strategic levels, including actionable leads, complex written products, and formal or informal briefings. Identify and facilitate the sharing of data with the client and mission partners via the client’s Cloud architecture and Web–based capabilities. Work with the user community to gather feedback on capabilities to ensure capabilities meet mission requirements, gather insight into capability gaps,and work with developers to improve upon existing capabilities and develop new capabilities.","*3+ years of experience with providing direct support to operational organizations*3+ years of experience with all–source intelligence analysis, including counter human trafficking, counter narcotics, and counter threats*Experience in working with Voltron, DataXplorer, JEMA-IC, M3, TAC, ICReach, TIDE, Firetruck, the Joint Improvised–Threat Defeat Organization (JIDO)’s Attack the Network Tools Suite, Analyst Notebook, or Palantir*TS/SCI clearance*HS diploma or GED","*Experience with exploiting and dissecting large data sets*Experience with previous deployment in direct support of the client*Experience with training and briefing*Experience with Military Forces support*Experience with counter threat, C–IED, C–WMD, and counter narcotics analysis and problem sets*Experience with deployment to hostile environments*Experience with Google Earth, ArcGIS, and Proton*Experience with scripting, including JavaScript or Python and Regular Expressions*Possession of excellent oral and written communication skills"